{
  "schema_version": 1,
  "artifact_id": "T0-ARCH-LEARNER",
  "artifact_type": "baseline-architecture",
  "owner": "Learner",
  "reviewer": null,
  "scope": "tier-00",
  "revision": 1,
  "status": "template",
  "created_at": null,
  "last_reviewed_at": null,
  "source_revision": null,
  "environment": {
    "course_id": "learning-cyber-security",
    "tier": "00",
    "synthetic_data": true,
    "environment_id": null,
    "marker_fingerprint": null
  },
  "limitations": [],
  "content": {
    "components": [],
    "data_flows": [],
    "trust_boundaries": [],
    "notes": ""
  }
}
